{
  "oars_version": "0.4-draft",
  "record": {
    "id": "urn:example:record:minimal",
    "issued_at": "2027-01-01T00:00:00Z"
  },
  "scope": {
    "id": "urn:acme:oars:scope:claims-eu-production",
    "subject": {
      "id": "urn:acme:ai-system:claims-assistant",
      "type": "ai_system"
    },
    "context": {
      "id": "urn:acme:context:claims-eu-production",
      "purpose_ref": "urn:acme:use-case:claims-assistance"
    }
  },
  "effective": {
    "from": "2027-01-01T00:00:00Z"
  },
  "authority_envelope": {
    "grants": []
  },
  "assessment": {}
}
